<?xml version="1.0" encoding="UTF-8"?>
<!ELEMENT citations_auteurs (auteur*)>
<!ELEMENT auteur (texte*)>
<!ATTLIST auteur nom CDATA #REQUIRED>
<!ELEMENT texte (#PCDATA)>
